{
  "$comment": "SPDX-License-Identifier: Apache-2.0",
  "active_role": "architecture",
  "approval_date": "2030-01-01",
  "approval_state": "author_approved_for_execution",
  "approval_timestamp": "2030-01-01T00:00:00Z",
  "approved_scope": [
    "example scope"
  ],
  "authorized_mutation": "bounded governance source",
  "authorized_paths": [
    "tracked governance source"
  ],
  "authorized_repositories": [
    "example repository"
  ],
  "current_revision": 1,
  "dependency_permissions": {
    "existing": true,
    "new_external": false
  },
  "destructive_permissions": [
    "owned temporary cleanup"
  ],
  "explicit_exclusions": [
    "product behavior"
  ],
  "external_service_permissions": {
    "hosted_release": false,
    "push": false
  },
  "governance_contract_change": true,
  "lifecycle_state": "author_approved_for_execution",
  "material_revision_rule": "revise, reapprove, and reseal",
  "operating_mode": "integrated",
  "product_increment": false,
  "publication_authority": {
    "force_push": false,
    "push": false
  },
  "required_validation": [
    "focused tests"
  ],
  "revision_hash_set_encoding": "uppercase SHA-256 values in revision order, LF-terminated",
  "revision_hash_set_sha256": "343E5E20E286DAC1872B65CC26FC875D6083F0724D359BA1B3EF47C2C7FE5AA4",
  "schema": "dual-hat-sealed-work-order/1.1",
  "sealed_state": "immutable_approved_contract",
  "source_revisions": [
    {
      "approval_state": "author_approved_for_execution",
      "bytes": 0,
      "revision": 1,
      "sha256": "AAAAAAAAAAAAAAAAAAAAAAAAAAAAAAAAAAAAAAAAAAAAAAAAAAAAAAAAAAAAAAAA"
    }
  ],
  "stop_gates": [
    "new public contract"
  ],
  "title": "Example governance update",
  "work_item_id": "GOV-0000",
  "work_item_type": "gov",
  "work_order_hash": "EEF23EF3436981ACA3B91E569DE34B6B54065F7B633B4CD9B93D81B28A0EA9C6"
}
